{
  "$schema": "http://json-schema.org/draft-07/schema#",
  "title": "KHU offline requirement signal evidence v0.1.0",
  "type": "object",
  "additionalProperties": false,
  "required": ["evidence_type", "schema_version", "evidence_id", "request_sha256", "generated_at", "scope", "request", "result"],
  "properties": {
    "evidence_type": {"const": "khu.research.requirement_signal_evidence"},
    "schema_version": {"const": "0.1.0"},
    "evidence_id": {"type": "string", "pattern": "^sha256:[0-9a-f]{64}$"},
    "request_sha256": {"type": "string", "pattern": "^[0-9a-f]{64}$"},
    "generated_at": {"type": "string", "format": "date-time", "pattern": "^\\d{4}-\\d{2}-\\d{2}T\\d{2}:\\d{2}:\\d{2}(?:\\.\\d+)?Z$"},
    "scope": {
      "const": {
        "kind": "offline_application_requirement_signals",
        "deployment_authority": false,
        "input_metadata_verified": false
      }
    },
    "request": {"$ref": "#/definitions/request"},
    "result": {"$ref": "#/definitions/result"}
  },
  "definitions": {
    "request": {
      "type": "object",
      "additionalProperties": false,
      "required": ["model_id", "model_revision", "workload_task", "batch_size", "max_length", "request_concurrency", "decision_at", "parameter_metadata", "hardware_profile"],
      "properties": {
        "model_id": {"type": "string", "minLength": 1},
        "model_revision": {"type": "string", "pattern": "^[0-9a-fA-F]{40}$"},
        "workload_task": {"const": "inference"},
        "batch_size": {"type": "integer", "minimum": 1},
        "max_length": {"type": "integer", "minimum": 1},
        "request_concurrency": {"type": "integer", "minimum": 1},
        "decision_at": {"type": "string", "format": "date-time"},
        "parameter_metadata": {
          "type": "object",
          "additionalProperties": false,
          "required": ["model_parameter_count", "model_parameter_bytes", "dtype", "calculation", "source", "available_at"],
          "properties": {
            "model_parameter_count": {"type": "integer", "minimum": 1},
            "model_parameter_bytes": {"type": "integer", "minimum": 1, "maximum": 9223372036854775807},
            "dtype": {"const": "float32"},
            "calculation": {"const": "sum(parameter.numel() * parameter.element_size() for parameter in model.parameters())"},
            "source": {"enum": ["application_registry", "registration_manifest"]},
            "available_at": {"type": "string", "format": "date-time"}
          }
        },
        "hardware_profile": {"$ref": "#/definitions/hardware_profile"}
      }
    },
    "hardware_profile": {
      "const": {
        "host": "icns",
        "device": "cuda",
        "device_name": "NVIDIA RTX PRO 5000 Blackwell",
        "gpu_indices": [0],
        "replica_count": 1,
        "cpu_core_limit": 2,
        "cpu_threads": 2
      }
    },
    "signal": {
      "type": "object",
      "additionalProperties": false,
      "required": ["status", "estimate", "unit", "target_definition", "training_relation", "artifact_sha256", "reasons"],
      "properties": {
        "status": {"enum": ["RESEARCH_ESTIMATE", "ABSTAIN"]},
        "estimate": {"type": ["number", "null"]},
        "unit": {"enum": ["GiB", "seconds"]},
        "target_definition": {"type": "string", "minLength": 1},
        "training_relation": {"enum": ["DECLARED_UNSEEN_MODEL", "IN_SAMPLE_EXPLORATORY", "UNKNOWN"]},
        "artifact_sha256": {"type": "string", "pattern": "^[0-9a-f]{64}$"},
        "reasons": {"type": "array", "items": {"type": "string", "minLength": 1}}
      },
      "allOf": [
        {
          "if": {"properties": {"status": {"const": "RESEARCH_ESTIMATE"}}},
          "then": {"properties": {"estimate": {"type": "number", "exclusiveMinimum": 0}, "reasons": {"maxItems": 0}}},
          "else": {"properties": {"estimate": {"type": "null"}, "reasons": {"minItems": 1}}}
        }
      ]
    },
    "result": {
      "type": "object",
      "additionalProperties": false,
      "required": ["scope", "metadata_provenance", "artifact_hashes_verified_at_load", "source_sha256", "training_sklearn_version", "runtime_sklearn_version", "runtime_numpy_version", "runtime_pandas_version", "runtime_joblib_version", "hardware_profile", "signals"],
      "properties": {
        "scope": {"type": "string", "minLength": 1},
        "metadata_provenance": {"const": "caller_declared"},
        "artifact_hashes_verified_at_load": {"const": true},
        "source_sha256": {"type": "string", "pattern": "^[0-9a-f]{64}$"},
        "training_sklearn_version": {"type": "string", "minLength": 1},
        "runtime_sklearn_version": {"type": "string", "minLength": 1},
        "runtime_numpy_version": {"type": "string", "minLength": 1},
        "runtime_pandas_version": {"type": "string", "minLength": 1},
        "runtime_joblib_version": {"type": "string", "minLength": 1},
        "hardware_profile": {"$ref": "#/definitions/hardware_profile"},
        "signals": {
          "type": "object",
          "additionalProperties": false,
          "required": ["observed_cuda_reserved_peak_gib", "cached_local_load_seconds"],
          "properties": {
            "observed_cuda_reserved_peak_gib": {"$ref": "#/definitions/signal"},
            "cached_local_load_seconds": {"$ref": "#/definitions/signal"}
          }
        }
      }
    }
  }
}
