{
  "evidence_type": "khu.research.requirement_signal_evidence",
  "schema_version": "0.1.0",
  "request_sha256": "de76102899b95a2a43c185e82653701a762b76e5f5aa83ab48d50fe09e6359da",
  "generated_at": "2026-09-29T05:00:00Z",
  "scope": {
    "kind": "offline_application_requirement_signals",
    "deployment_authority": false,
    "input_metadata_verified": false
  },
  "request": {
    "model_id": "example/offline-new-encoder",
    "model_revision": "bbbbbbbbbbbbbbbbbbbbbbbbbbbbbbbbbbbbbbbb",
    "workload_task": "inference",
    "batch_size": 1,
    "max_length": 32,
    "request_concurrency": 1,
    "decision_at": "2026-09-28T12:00:00Z",
    "parameter_metadata": {
      "model_parameter_count": 20000000,
      "model_parameter_bytes": 80000000,
      "dtype": "float32",
      "calculation": "sum(parameter.numel() * parameter.element_size() for parameter in model.parameters())",
      "source": "registration_manifest",
      "available_at": "2026-09-28T11:00:00Z"
    },
    "hardware_profile": {
      "host": "icns",
      "device": "cuda",
      "device_name": "NVIDIA RTX PRO 5000 Blackwell",
      "gpu_indices": [
        0
      ],
      "replica_count": 1,
      "cpu_core_limit": 2,
      "cpu_threads": 2
    }
  },
  "result": {
    "scope": "Offline research evidence on icns RTX PRO 5000 Blackwell GPU 0, CUDA replica 1, CPU affinity 2. No minimum VRAM, OOM, VM startup, deployment, or scaling decision.",
    "metadata_provenance": "caller_declared",
    "artifact_hashes_verified_at_load": true,
    "source_sha256": "b7bba7963e8a309b6a8502a1d98eefb150476b1381ec016beeb68cbf63fae906",
    "training_sklearn_version": "1.6.1",
    "runtime_sklearn_version": "1.6.1",
    "runtime_numpy_version": "2.0.2",
    "runtime_pandas_version": "2.3.0+4.g1dfc98e16a",
    "runtime_joblib_version": "1.5.1",
    "hardware_profile": {
      "host": "icns",
      "device": "cuda",
      "device_name": "NVIDIA RTX PRO 5000 Blackwell",
      "gpu_indices": [
        0
      ],
      "replica_count": 1,
      "cpu_core_limit": 2,
      "cpu_threads": 2
    },
    "signals": {
      "observed_cuda_reserved_peak_gib": {
        "status": "RESEARCH_ESTIMATE",
        "estimate": 0.20821557769515572,
        "unit": "GiB",
        "target_definition": "empirical_q90_of_observed_torch_cuda_max_memory_reserved",
        "training_relation": "DECLARED_UNSEEN_MODEL",
        "artifact_sha256": "21387fd6ba6b6185737ed9e10ba0930b9c2696e033ac532287bd84e8f6501e01",
        "reasons": []
      },
      "cached_local_load_seconds": {
        "status": "RESEARCH_ESTIMATE",
        "estimate": 0.1875111137242485,
        "unit": "seconds",
        "target_definition": "cached_local_huggingface_model_and_tokenizer_load_seconds",
        "training_relation": "DECLARED_UNSEEN_MODEL",
        "artifact_sha256": "39a8d614c101a89d1ec65dca136a4c24415da3b0d41ff8f4209422fd9ee76131",
        "reasons": []
      }
    }
  },
  "evidence_id": "sha256:6dff682cc2710be18346c1f28ee7c1e926673f7c8ba8bc3bae268b75220a3fe1"
}
